{"id":"CLS-930007","schemaVersion":"0.1.0","recordVersion":"0.1.0","revision":0,"status":"Deprecated","createdAt":"2026-09-24T10:00:00Z","createdBy":"example-author","updatedAt":"2026-09-24T10:00:00Z","updatedBy":"example-author","sourceLinks":[],"changeSummary":"Fictional validation fixture.","name":"Example Classification Eta","description":"Fictional classification meaning used only for contract validation.","replacedBy":"CLS-939999"}
